{
  "location": {
    "city": "Peru",
    "county": "Miami County",
    "state": "IN",
    "defaultCenter": {
      "lat": 40.7537,
      "lng": -86.0689
    },
    "defaultZoom": 14
  },
  "emailSubjectTemplate": "Report: {category} - {location}",
  "emailTemplate": "CIVIC REPORT: {category}\nDepartment: {department}\nLocation: {location}\nCoordinates: {mapsUrl}\n--------------------------------------------------\n\n{answers}\n\n--------------------------------------------------\nReport generated via Peru Community 311 (open-source citizen portal)",
  "categories": [
    {
      "id": "wabash-flats",
      "name": "Wabash Flats Issue",
      "department": "River Valley Communities LLC",
      "description": "Report Issues ",
      "icon": "city",
      "destinations": {
        "email": "jgriebel0234@gmail.com",
        "phone": "(513) 218-0083",
        "webformUrl": "https://www.bbb.org/us/oh/cincinnati/profile/manufactured-home-rental/river-valley-communities-0292-90022746",
        "socialUrl": null,
        "address": "6310 E. Kemper Rd # 125\nCincinnati, OH 45241"
      },
      "questions": [],
      "jurisdiction": {
        "polygons": [
          {
            "type": "Polygon",
            "coordinates": [
              [
                [
                  -86.071792,
                  40.763544
                ],
                [
                  -86.068541,
                  40.763523
                ],
                [
                  -86.068461,
                  40.761736
                ],
                [
                  -86.070102,
                  40.761736
                ],
                [
                  -86.070129,
                  40.762276
                ],
                [
                  -86.071787,
                  40.762248
                ],
                [
                  -86.071792,
                  40.763544
                ]
              ]
            ],
            "name": "Wabash Flats"
          }
        ]
      }
    },
    {
      "id": "street_sanitation",
      "name": "Street Surface & Debris (Potholes, Roadkill, Obstructions)",
      "department": "Street & Sanitation Department (Brian Stillings, Commissioner)",
      "description": "Report potholes, asphalt damage, roadkill removal on street/alley, fallen road debris, or missed trash collection.",
      "icon": "road-circle-xmark",
      "destinations": {
        "email": "brians@cityofperu.org",
        "webformUrl": "https://www.cityofperu.org/egov/apps/action/center.egov?view=form;page=1;id=33",
        "phone": "(765) 472-2501",
        "address": "351 E Canal St, Peru, IN 46970",
        "socialUrl": null
      },
      "questions": [
        {
          "id": "issue_type",
          "label": "Type of Roadway / Surface Hazard",
          "type": "select",
          "required": true,
          "options": [
            "Pothole / Deep Asphalt Crater",
            "Deceased Animal Removal (Roadkill on Public Street)",
            "Roadway Obstruction / Fallen Cargo / Debris",
            "Snow / Ice Removal Request",
            "Other"
          ]
        },
        {
          "id": "traffic_impact",
          "label": "Traffic Impact",
          "type": "select",
          "required": true,
          "options": [
            "No - Traffic moving normally",
            "Partially - Drivers must slow down or swerve",
            "Completely - Lane or alley completely blocked"
          ]
        },
        {
          "id": "details",
          "label": "Location Details & Description",
          "type": "textarea",
          "required": false,
          "placeholder": "Dead animal in the northbound lane, needs removed"
        }
      ],
      "jurisdiction": {
        "excludedPolygons": [
          {
            "type": "Polygon",
            "coordinates": [
              [
                [
                  -86.07183,
                  40.762248
                ],
                [
                  -86.071744,
                  40.763523
                ],
                [
                  -86.068525,
                  40.763515
                ],
                [
                  -86.068504,
                  40.761752
                ],
                [
                  -86.070092,
                  40.76176
                ],
                [
                  -86.070102,
                  40.762304
                ],
                [
                  -86.07183,
                  40.762248
                ]
              ]
            ]
          },
          {
            "type": "Polygon",
            "coordinates": [
              [
                [
                  -86.08449,
                  40.76048
                ],
                [
                  -86.084318,
                  40.758156
                ],
                [
                  -86.083889,
                  40.757928
                ],
                [
                  -86.080885,
                  40.758936
                ],
                [
                  -86.080606,
                  40.758627
                ],
                [
                  -86.077924,
                  40.759537
                ],
                [
                  -86.078868,
                  40.761634
                ],
                [
                  -86.08449,
                  40.76048
                ]
              ]
            ]
          }
        ]
      }
    },
    {
      "id": "traffic_signals_signs",
      "name": "Traffic Signals, Signs & Road Control Devices",
      "department": "Traffic Department (Todd Wolfe, Department Head)",
      "description": "Report broken or dark traffic lights, knocked-down stop/yield signs, missing street markers, or damaged signal poles.",
      "icon": "fa-traffic-light",
      "destinations": {
        "email": "trafficdept@cityofperu.org",
        "webformUrl": "https://www.cityofperu.org/",
        "phone": "(765) 473-5821",
        "address": "351 E Canal St, Peru, IN 46970",
        "socialUrl": null
      },
      "questions": [
        {
          "id": "traffic_issue",
          "label": "Traffic Infrastructure Issue",
          "type": "select",
          "required": true,
          "options": [
            "Traffic Signal Dark / Flashing / Malfunctioning",
            "Damaged or Knocked-Down Stop / Yield Sign",
            "Missing Street Name Sign",
            "Crosswalk / Curb Line Painting Need",
            "Damaged Traffic Signal Pole / Push Button"
          ]
        },
        {
          "id": "details",
          "label": "Intersection or Location Details",
          "type": "textarea",
          "required": false,
          "placeholder": "e.g. Stop sign knocked down at the corner of Broadway and Main St."
        }
      ]
    },
    {
      "id": "foliage_hazard_tree",
      "name": "Hazardous Trees, Foliage & Sign Visibility Obstructions",
      "department": "Peru Street Dept / Utility Line Trim / Parks Dept",
      "description": "Report overgrown branches blocking stop signs/sightlines, fallen limbs blocking roads, or tree branches threatening power/telecom wires.",
      "icon": "fa-leaf",
      "destinations": {
        "email": "mayorsadmin@cityofperu.org",
        "webformUrl": "https://www.cityofperu.org/",
        "phone": "(765) 472-2501",
        "address": "351 E Canal St, Peru, IN 46970",
        "socialUrl": null
      },
      "questions": [
        {
          "id": "foliage_issue",
          "label": "Foliage / Tree Safety Hazard",
          "type": "select",
          "required": true,
          "options": [
            "Overgrown Tree / Hedge Obscuring Stop Sign or Intersection View",
            "Fallen Tree Branch Blocking Roadway / Alley / Sidewalk",
            "Tree Limb Resting on Wires (Power / Telecom)",
            "Dead or Leaning Municipal Tree Posing Immediate Fall Risk"
          ]
        },
        {
          "id": "near_utility_lines",
          "label": "Is the tree touching power or utility lines?",
          "type": "select",
          "required": true,
          "options": [
            "No - Clear of utility lines",
            "Yes - Touching or tangled in electrical / telecom lines",
            "Unsure"
          ]
        },
        {
          "id": "details",
          "label": "Specific Location & Visual Description",
          "type": "textarea",
          "required": false,
          "placeholder": "e.g. Low pine branch completely blocks view of stop sign approaching 5th & Broadway."
        }
      ]
    },
    {
      "id": "stormwater_flooding_drain",
      "name": "Storm Drains, Flooding & Railroad Underpass (Broadway Tunnel)",
      "department": "Peru Utilities - Stormwater & Drainage",
      "description": "Report clogged storm drain catch basins, standing water at the Broadway Tunnel underpass, or localized street flooding.",
      "icon": "fa-cloud-showers-heavy",
      "destinations": {
        "email": null,
        "webformUrl": "https://www.peruutilities.com/my-account-1/report-a-problem/",
        "phone": "(765) 473-6681",
        "address": "335 E Canal St, Peru, IN 46970",
        "socialUrl": "https://www.facebook.com/PeruUtilities"
      },
      "questions": [
        {
          "id": "stormwater_issue",
          "label": "Drainage / Flooding Problem",
          "type": "select",
          "required": true,
          "options": [
            "Railroad Underpass Flooded / Standing Water (Broadway Tunnel)",
            "Clogged Storm Drain Inlet / Leaf & Trash Accumulation",
            "Localized Street Flooding / Surface Overflow",
            "Creek Bank Erosion / Riverbank / Ditch Washout",
            "Stormwater Contamination / Illegal Dumping in Drain"
          ]
        },
        {
          "id": "details",
          "label": "Specific Location & Water Depth Details",
          "type": "textarea",
          "required": false,